{
  "schema": "evaluation/1",
  "timestamp": "2026-10-06T21:14:25.290155+00:00",
  "environment": {
    "os": "Linux",
    "python": "3.14.4",
    "sqlite": "3.46.1"
  },
  "source_commit_at_run": "aa293d5867fdd47eb31ea72045dcf480eafe3e2f",
  "source_hashes": {
    "runtime.py": "851a3d3fe2f660a29e4272c6e32812eb6fd02382bae214917af59a5a5dafa0b4",
    "app.py": "ba3c5cc049612614ba597892e3169e9134b0906486c53f11c3be2220699a1289",
    "evaluate.py": "a069d4b75c21f4d6f02e911dd2dd3d9f8cac1378fee70bc617f92e4b8d9d29dd",
    "tests/test_workflow.py": "7e5f757eb0aa87464867786281dd8fc82aa2e3b8877a58fc13436fcb68713bb2",
    "fixtures/documents.json": "ec282ae548f8f731a1873227255c83fda512de74dbe459f3b894eda822409b34",
    "web/index.html": "86882d6a530e32df936e81e2000ffb52ea4247b837d24bcc71e4f96ac3640a1a",
    "web/ui.js": "b2d9b609ce260ac7271c823a68c4d6826615a5591f4ecd290882a2016f3fe9c4",
    "web/style.css": "76590e6140bcd1529f5b0ba6a75b25a9c1de65d4fa4f1c9336718f4501044883",
    "workers.py": "135bdb38373744dbc5f045a916078be602e0ff25e9c66ebd5c34912d1e2ea845",
    "feeds.py": "a87a6043f65588375f679d9cdbe5503b43ad903c896ca6ecdfa61b4462ff7a02",
    "capsules.py": "3bfc0ec8b5cd743d887cf0daab1739c519e8c21278984987f55fe72a96202f10",
    "context.py": "853fb8e647894a01a73a4c481054e638e0b7ec8b486ddfd3d1ae71aee3ed6866",
    "scan.py": "ee6f663e0b6109ce57c946705a26e1310d1e973115f116e8ffbec5913dc6f169",
    "qos.py": "81e1b2055d04d0a6555ce70783e8bee0155c931185b86be93c2f35f1e0ca8e63",
    "go.mod": "9c7d5cb29f280bd02d01f07c1835ee3dfdd33f3cce2ca37d0e93f09b1e4ab925",
    "cmd/worker/main.go": "c8318f9f4038558344f723c30c8597a440cd93021d89db9210f65232f1943b8c",
    "cmd/worker/main_test.go": "b3bc3f7d75ec768c31a05a771b79b96dd4f452e00e131059168ee23d9328263b",
    "scripts/project.py": "dce5365830f7242ffa3cb88d2dbb27b5c263d13046aec0dfa245a5fc07759534",
    "scripts/check_public.py": "69e7a80eea7c8ae9d34cb74b511b58c24434949a44b85bc09c6eaa620ab9afc0",
    "contracts/dictionary.json": "796ccf8e5750b8cb790af3c0d722cb5e2db1b762a6fed558d46d7a804358ea3f",
    "contracts/design.json": "bc0c3c9ceed8c93b10d1cd1a50bd6e936d3ca0c9ece7bcdd90668801c08a30bb",
    "contracts/claims.json": "2d3f115ca78ec02361cda21095bc497c45ab8a6fd7150e021086007f43e5aa2c",
    "contracts/hypotheses.json": "5afe59b44d2eeef9dd1abcadb40b39d06213596f44119c59201ba580d4e17e1b",
    "contracts/room.json": "4bc1c291f696a488bcdb87505f56b7a546f868ab74a1b8606419f73703e85811",
    "scripts/build_linux.py": "66001af3a5c50845bb04901e24322597800f704144017f5d400f2edc763ce51e",
    "scripts/go_evaluate.py": "33cb3a4e081ae1e61fd8a8d023702bc1a9100a4dcd42552376e9c281492b375a",
    "schemas/evaluation.schema.json": "078424f7f3ee29d43d123dab32aa977167a3bbdce52a4a0150928a194fda11db",
    ".github/workflows/evidence.yml": "f57a43b5e893956f7edcd3def286938943b08d38fae9103aef131fee1d9d636a"
  },
  "scope": "SYNTHETIC_LOCAL_FIXTURES_REAL_SQLITE_REAL_SUBPROCESSES",
  "planner": "deterministic-extractive/1",
  "model_calls": 0,
  "provider_cost_usd": 0,
  "semantic_accuracy": null,
  "human_usability": null,
  "independent_review": null,
  "cases": [
    {
      "id": "test_workflow.WorkflowTests.test_approval_denial_and_positive_control",
      "status": "PASS",
      "elapsed_ms": 143.466232,
      "detail": null
    },
    {
      "id": "test_workflow.WorkflowTests.test_artifact_tamper_detected_on_replay",
      "status": "PASS",
      "elapsed_ms": 87.789024,
      "detail": null
    },
    {
      "id": "test_workflow.WorkflowTests.test_cancellation_survives_restart",
      "status": "PASS",
      "elapsed_ms": 84.649826,
      "detail": null
    },
    {
      "id": "test_workflow.WorkflowTests.test_capsule_topology_dictionary_and_projection",
      "status": "PASS",
      "elapsed_ms": 32.753336,
      "detail": null
    },
    {
      "id": "test_workflow.WorkflowTests.test_case_isolation_and_source_spelling",
      "status": "PASS",
      "elapsed_ms": 145.699338,
      "detail": null
    },
    {
      "id": "test_workflow.WorkflowTests.test_cloud_feed_destination_boundary",
      "status": "PASS",
      "elapsed_ms": 21.572115,
      "detail": null
    },
    {
      "id": "test_workflow.WorkflowTests.test_cloud_spider_then_case_hydration",
      "status": "PASS",
      "elapsed_ms": 140.912817,
      "detail": null
    },
    {
      "id": "test_workflow.WorkflowTests.test_concurrent_workers_commit_one_artifact",
      "status": "PASS",
      "elapsed_ms": 301.774494,
      "detail": null
    },
    {
      "id": "test_workflow.WorkflowTests.test_context_prefix_budget_and_memory_supersession",
      "status": "PASS",
      "elapsed_ms": 135.340109,
      "detail": null
    },
    {
      "id": "test_workflow.WorkflowTests.test_cpu_reranker_feedback_is_case_query_and_source_scoped",
      "status": "PASS",
      "elapsed_ms": 188.17391,
      "detail": null
    },
    {
      "id": "test_workflow.WorkflowTests.test_duplicate_request_conflict_and_replay",
      "status": "PASS",
      "elapsed_ms": 79.32697,
      "detail": null
    },
    {
      "id": "test_workflow.WorkflowTests.test_end_to_end_source_bound_artifact",
      "status": "PASS",
      "elapsed_ms": 64.573037,
      "detail": null
    },
    {
      "id": "test_workflow.WorkflowTests.test_http_origin_token_boundary_and_ui_action",
      "status": "PASS",
      "elapsed_ms": 574.963163,
      "detail": null
    },
    {
      "id": "test_workflow.WorkflowTests.test_hydrate_no_network_and_explicit_frame",
      "status": "PASS",
      "elapsed_ms": 77.154716,
      "detail": null
    },
    {
      "id": "test_workflow.WorkflowTests.test_invalid_inputs_and_duplicate_sources",
      "status": "PASS",
      "elapsed_ms": 4.529413,
      "detail": null
    },
    {
      "id": "test_workflow.WorkflowTests.test_local_feed_then_hydration",
      "status": "PASS",
      "elapsed_ms": 170.810065,
      "detail": null
    },
    {
      "id": "test_workflow.WorkflowTests.test_no_context_abstains",
      "status": "PASS",
      "elapsed_ms": 102.7672,
      "detail": null
    },
    {
      "id": "test_workflow.WorkflowTests.test_payload_and_tool_tamper_denied",
      "status": "PASS",
      "elapsed_ms": 63.681368,
      "detail": null
    },
    {
      "id": "test_workflow.WorkflowTests.test_process_kill_after_commit_replays_without_duplicate",
      "status": "PASS",
      "elapsed_ms": 217.941957,
      "detail": null
    },
    {
      "id": "test_workflow.WorkflowTests.test_process_kill_before_commit_rolls_back",
      "status": "PASS",
      "elapsed_ms": 177.561306,
      "detail": null
    },
    {
      "id": "test_workflow.WorkflowTests.test_python_ast_map_does_not_execute_source",
      "status": "PASS",
      "elapsed_ms": 17.251218,
      "detail": null
    },
    {
      "id": "test_workflow.WorkflowTests.test_qos_token_bucket_burst_and_refill",
      "status": "PASS",
      "elapsed_ms": 0.880971,
      "detail": null
    },
    {
      "id": "test_workflow.WorkflowTests.test_real_go_math_frame_and_decimal_precision",
      "status": "PASS",
      "elapsed_ms": 93.022035,
      "detail": null
    },
    {
      "id": "test_workflow.WorkflowTests.test_real_go_topology_frame_from_explicit_links",
      "status": "PASS",
      "elapsed_ms": 133.892396,
      "detail": null
    },
    {
      "id": "test_workflow.WorkflowTests.test_receipt_tamper_detected",
      "status": "PASS",
      "elapsed_ms": 67.014494,
      "detail": null
    },
    {
      "id": "test_workflow.WorkflowTests.test_scoped_dictionary_routes_and_revision_revokes_approval",
      "status": "PASS",
      "elapsed_ms": 54.051733,
      "detail": null
    },
    {
      "id": "test_workflow.WorkflowTests.test_source_change_invalidates_old_approval",
      "status": "PASS",
      "elapsed_ms": 145.217555,
      "detail": null
    },
    {
      "id": "test_workflow.WorkflowTests.test_stateless_worker_has_no_cross_call_context",
      "status": "PASS",
      "elapsed_ms": 103.228091,
      "detail": null
    },
    {
      "id": "test_workflow.WorkflowTests.test_untrusted_source_is_not_authority",
      "status": "PASS",
      "elapsed_ms": 56.301427,
      "detail": null
    },
    {
      "id": "test_workflow.WorkflowTests.test_utf8_unicode_roundtrip_without_normalization",
      "status": "PASS",
      "elapsed_ms": 88.784225,
      "detail": null
    },
    {
      "id": "test_workflow.WorkflowTests.test_view_reads_one_snapshot_during_concurrent_write",
      "status": "PASS",
      "elapsed_ms": 20.388118,
      "detail": null
    },
    {
      "id": "test_workflow.WorkflowTests.test_worker_capacity_backpressure",
      "status": "PASS",
      "elapsed_ms": 59.87964,
      "detail": null
    }
  ],
  "passed": 32,
  "total": 32,
  "status": "PASS",
  "process_kill": "OS_PROCESS_TERMINATION_NOT_POWER_FAILURE",
  "receipt_hash": "4040c6f5abdfc9330189536ac84b255eefd81dda6fb439d48e8c99c08c90b0de"
}
